id, label, description
5788,The Gymternet gymnast ID,identifier for a gymnast on the Gymternet website
5789,WorldofVolley player ID,identifier for a volleyball player on the WorldofVolley website
5790,Skijumping.pl jumper ID,identifier for a ski jumper on the Skijumping.pl website
5791,Cineuropa film ID,identifier for a movie at Cineuropa
5792,NooSFere series ID,identifier for a series in NooSFere Database
5793,Dobry słownik ID,identifier for an entry in the online dictionary of Polish language (pl Dobry słownik)
5794,IGDB game ID,identifier for a game on the Internet Game Database
5795,IGDB platform ID,identifier for a platform on the Internet Game Database
5796,IGDB person ID,identifier for a person on the Internet Game Database
5797,Twitch channel ID,ID of a Twitch channel
5798,Thomson Reuters Business Classification,"use for companies, industries, products"
5799,AustLII ID,identifier in the Australasian Legal Information Institute (AustLII) online database
5800,narrative role,narrative role or character type this character conforms to (should be used as a qualifier with P674 or restricted to a certain work using P642)
5801,Academia.edu topic ID,identifier for a research topic on the Academia.edu website
5802,stage crew member,member of the technical crew who supervises and operates the various technical aspects of the production during a stage performance
5803,VOR/DME identifier for airport beacons,VOR/DME identifier for airport beacons
5804,has program committee member,
5805,OSI Model layer location,location of a network protocol in one of the OSI Model layers
5806,SNOMED CT identifier,"identifier in the SNOMED CT catalogue codes for diseases, symptoms and procedures"
5807,Alternativa Teatral person ID,
5808,Alternativa Teatral work ID,
5809,Alternativa Teatral place ID,
5810,cryptocurrency symbol,the symbol or identifier of a cryptocurrency based on the Naming Consistency of CCXT
5811,elongation at break,material property; the ratio between changed length and initial length after breakage of the test specimen. It expresses the capability of a material to resist changes of shape without crack formation.
5813,MusicBrainz release ID,identifier for a release in the MusicBrainz open music encyclopedia (edition)
5814,IANA service name,name of a network service defined in Q30335969
5815,Olympic Channel athlete ID,identifier for an athlete at the Olympic Channel website (OlympicChannel.com)
5816,state of conservation,"to indicate state of conservation of a building, monument, etc. It is not related with its heritage protection (P1435), but to its present state of conservation. Ex.: ruinous, demolished, correct, etc."
5817,state of use,"to indicate state of use of a building, monument, etc. It is not related with its heritage protection (P1435), but to its present state of use. Ex.: reformed, in use, temporarily closed, etc."
5818,BGCI garden ID,identifier for a botanical garden in the Botanic Gardens Conservation International online database
5819,International Mathematical Olympiad participant ID,identifier of an International Mathematical Olympiad participant on the official website of IMO
5820,Film Indonesia ID,Indonesian Movie database ID
5821,ArhivX LOD,Croatian art/theater linked open data
5822,admission rate,ratio of the number of applicants admitted to the total number of applicants
5823,Belvedere object ID,identifier for an artwork in the Österreichische Galerie Belvedere in Vienna
5824,is retracted by,(article) is retracted by (retraction notice)
5825,ISO 15919 transliteration,representation according to the named ISO standard for transliterating Brahmic scripts
5826,majority opinion by,judicial opinion agreed to by more than half of the members of a court
5827,National Trust for Historic Preservation ID,identifier for a place on the National Trust for Historic Preservation website
5828,seed,seeding information of a participant of a sports event
5829,Television Academy Foundation show ID,identifier for a television show discussed on the Television Academy Foundation's The Interviews website
5830,demonstrates form,(qualifier) the form of a lexeme which is demonstrated by a usage example
5831,usage example,example of how a lexeme might be used
5832,political coalition,agreement for cooperation between different political parties
5833,Playbill production ID,identifier for a theatrical production in the Playbill.com database
5834,Leading Hotels of the World hotel ID,identifier for an hotel on the Leading Hotels of the World website
5835,World Travel Awards ID,identifier for a nominee on the World Travel Awards website
5836,Relais & Châteaux ID,identifier for an hotel or restaurant on the Relais & Châteaux website
5838,Nintendo GameID,Six-alphanumeric-character Nintendo GameID for a specific game
5839,Académie de Marseille member ID,identifier for a member of the 'Académie de Marseille' on its website
5840,NPR podcast ID,identifier for a podcast on National Public Radio (NPR)
5841,Status in the Red List of Threatened Species in the Czech Republic,endangerment status of species in the national Red List of the Czech Republic
5842,Apple Podcasts podcast ID,identifier for a podcast in iTunes
5843,Gynopedia place ID,"identifier for a place (city, region or country) on the Gynopedia wiki about sexual and reproductive health care"
5844,Vocabolario Treccani ID,ID for lexemes
5845,AnimeClick anime ID,identifier of anime from AnimeClick database
5846,AnimeClick novel ID,identifier of novel from AnimeClick database
5847,AnimeClick character ID,identifier of character from AnimeClick database
5848,AnimeClick person ID,identifier of person from AnimeClick database
5849,AnimeClick manga ID,identifier of manga from AnimeClick database
5851,Ex-USSR internal airport code,airport code similar to IATA codes but only for Russian and CEI airports
5852,item inherits value from,this value is inherited from the parent (super)class; parent class has exactly the same statement as this statement (To be used in a source field)
5858,Index Herbariorum code,code in Index Herbariorum for plant collections
5859,Adelphi author ID,identifier for author on adelphi.it
5860,AnimeClick drama ID,identifier of drama from AnimeClick database
5862,Lepidoptera of Belgium ID,identifier in the Catalogue of Lepidoptera of Belgium
5863,CharacTour character ID,
5864,Enciclovida ID,"identification in Enciclovida, an Encyclopedia of plants, fungi and animals of Mexico"
5865,IGN film ID,identifier for films at the IGN website
5866,LakeNet ID,number of a lake in Global Lake Database
5867,Mathematical Reviews journal ID,number of a journal in Mathematical Reviews website
5868,MobyGames platform ID,identifier for a platform in MobyGames
5869,model item,"defines which item is a best practice example of modelling a subject, which is described by the value of this property, usage instructions at Wikidata:Model item"
5870,Northern Ireland Assembly ID,Identifier for a member of the Northern Ireland Assembly
5871,Norwegian war refugees register ID,Norwegian register for refugees at Kjesæter 1940 to 1945 ID
5872,perfume note,the note of a perfume
5873,place of devotion,place where a religious devotion was practiced and for which this devotional image (or text) was produced
5874,re3data repository ID,identifier for a data repository in the re3data registry
5875,ResearchGate publication identifier,identifier of a publication in ResearchGate
5876,SJPXVII ID,identifier for an entry in the electronic dictionary of the Polish language of the 17th and 18th centuries
5877,SPXVI ID,identifier for an entry in the Polish dictionary of the 16th century (pl: Słownik polszczyzny XVI wieku)
5878,Taxonomic Literature 2 number,catalogue number in Taxonomic Literature 2
5879,Qualité Tourisme ID,identifier for a place on the Qualité Tourisme website
5880,video designer,person responsible for the creation and integration of film and motion graphics on a stage
5881,projection designer,person responsible for producing all moving and still images that are displayed during a live performance
5882,Muziekweb performer ID,"identifier for a performer, composer or artist at Muziekweb"
5883,Tourisme & Handicap ID,identifier for a place on the Tourisme & Handicap website
5884,Dapodikdasmen ID,identifier for a school in Indonesia
5885,Microsoft Store product ID,identifier for a application in Microsoft Store
5886,mode of derivation,(qualifier) the way that a term is derived in P5191
5887,Arkivportalen agent ID,"identifier for an actor (person or institution) in Arkivportalen, a website for Norwegian archives"
5888,Arkivportalen archive ID,"identifier for an archive in Arkivportalen, a website for Norwegian archives"
5890,Preferred Hotels & Resorts hotel ID,identifier for an hotel on the Preferred Hotels & Resorts website
5891,Bpk-ID,"Bpk-identificator, identifier for art photos by picture agency, Image Bank of cultural institutions"
5892,UOL Eleições ID,іdentifier for elections in Brazil containing voting data for each position per State
5893,work hardening strain,the strengthening of a material by the specified ratio of plastic deformation
5894,tuition fee,"the tuition fee at an educational instition (default duration:1 year, use duration qualifier to specify)"
5895,foreign transaction fee,foreign transaction fee applies to payments in foreign currencies
5896,trading fee,"a trading fee or brokerage commision is fee charged when buying stock or commodities at exchanges or at a bank, use qualifier applies to part for maker and taker fee"
5897,account charge / subscription fee,a monthly/yearly fee for using a service or account; use qualifier duration to specify the billing cycle
5898,borrowing rate,the p.a. borrowing/lending rate
5899,interest rate,The yearly interest rate
5900,JMA Magnitude,Magnitude of an earthquake according to Japan Meteorological Agency
5901,official number of town quarter,"official number for the administrative division or section, region or part of a town"
5902,Uralonet ID,
5903,Álgu ID,
5904,ASCE Historical Civil Engineering Landmark ID,identifier for a landmark on the American Society of Civil Engineers website
5905,Comic Vine ID,"identifier at the Comic Vine database of comic books, fictional characters, people, films and television series/episodes"
5906,DxOMark ID,Dxomark article identifier for smartphones and cameras
5908,Geheugen van de VU person ID,identifier for a person in the database of Geheugen van de VU (Vrije Universiteit Amsterdam)
5909,HKCAN ID,Hong Kong Chinese Authority Name ID
5910,ENI number,European Vessel Identification Number for ships capable of navigating on inland European waters
5911,inflection class,"inflection class this lexeme belongs to, pattern of forms of the lexeme"
5912,Oqaasileriffik online dictionary ID,ID in the online dictionary of Oqaasileriffik
5913,has inflection class,inflectional pattern for groups of lexemes in the language
5914,IANA Root Zone Database ID,identifier in IANA's Root Zone Database of delegation details for top-level Internet domains
5915,Shazam track ID,identifier for an audio or audiovisual creative work on Shazam
5916,Spotify show ID,identifier for a show or podcast on Spotify
5917,Shazam artist ID,identifier for an artist on Shazam
5918,Sprockhoff Number,number assigned to megalithic installations in northern Germany by Ernst Sprockhoff
5920,root,part of word that does not have a prefix or a suffix
5921,Index of Historic Collectors and Dealers of Cubism ID,identifier for a person or an organization in the Index of Historic Collectors and Dealers of Cubism database
5922,ANZSRC FoR ID,"Australia and New Zealand Standard Research Classification 2008 identifier for a field of research.  1419 nodes at 3 levels: 22 Divisions, 157 Groups, 1340 Fields"
5923,creates lexeme type,morpheme creates this type of lexeme
5925,Moviepilot.de series ID,identifier for TV series on Moviepilot.de
5926,Spectral Database for Organic Compounds ID,
5927,Ultimate Guitar artist ID,identifier for an artist on Ultimate Guitar
5928,Ġabra lexeme ID,identifier for a lexeme in the Ġabra lexicon
5929,limiting oxygen index,"the minimum concentration of oxygen, expressed as a percentage, that will support combustion of a polymer"
5930,Open Food Facts ingredient ID,identifier of a food ingredient on Open Food Facts
5931,bazakolejowa.pl railway line ID,"ID of Polish railway line in database ""bazakolejowa.pl"""
5932,IGN series ID,unique string for sorting IGN items
5933,tweet ID,identifier of a status on Twitter
5934,Short Title Catalogue Flanders (STCV),identifier for a hand press book in the 'Short Title Catalogus Vlaanderen' (STCV) database of Flanders before 1801
5935,Flanders Arts Institute production ID,identifier of an production in the Flanders Arts Institute database for performing arts
5936,old-computers.com ID,identifier in the database of computing platforms old-computers.com
5937,Oudnederlands Woordenboek GTB ID,ID of entry in Oudnederlands Woordenboek on Geïntegreerde Taalbank
5938,Vroegmiddelnederlands Woordenboek GTB ID,ID of entry in Vroegmiddelnederlands Woordenboek on Geïntegreerde Taalbank
5939,Middelnederlandsch Woordenboek GTB ID,ID of entry in Middelnederlandsch Woordenboek on Geïntegreerde Taalbank
5940,plot expanded in,a narrative of this creative work is expanded in another work while '''not necessarily''' being part of the same series. For series use P179 instead
5941,Film Indonesia person ID,ID number on the Film Indonesia for the person and film studio
5942,Protected objects Ostbelgien ID,identifier of a protected heritage site of the German-speaking Community of Belgium
5944,North America PlayStation Store ID,identifier for a game available on the PlayStation Store (NA region)
5945,VicFlora ID,"identifier for a plant taxon, in the Australian 'Flora of Victoria' database"
5946,SUCA code,іdentifier of a specific urban {{Q|83620}} in the Madrid Region ({{Q|5756}}) provided by the {{Q|52637792}} catalog group of postal directions of {{Q|52775017}}
5947,Vicat softening point,the temperature at which the specimen is penetrated to a depth of 1 mm by a flat-ended needle with a 1 mm2 circular or square cross-section
5948,CMI person ID,identifier for a person on the Clay Mathematics Institute website
5949,Unicode range,unicode range this writings system or font is covered by. use CSS syntax described in https://developer.mozilla.org/en-US/docs/Web/CSS/%40font-face/unicode-range#Syntax
5950,São Paulo: os estrangeiros e a construção da cidade ID,"The database ""São Paulo: os estrangeiros e a construção da cidade"" is a research project supported by Q5508997 for creative work on Q174 in public GLAM institutions in the city."
5951,ComiXology creator ID,identifier of comics creators from the ComiXology digital comics storefront
5952,Annuaire de la magistrature ID,identifier for a French magistrature on the 'Annuaire rétrospectif de la magistrature'
5953,NT Flora ID,"identifier for a plant taxon, in the Northern Territory (Australia) 'NT Flora' database"
5954,Museu Nacional ID,online catalog ID for Museu Nacional
5955,Sekolah Kita ID,"identifier for a school in Indonesia (early childhood education, primary education, and  secondary education)"
5956,War Memorials Online ID,identifier for a war memorial on the War Memorials Online website
5957,ID of Inventory of the Archaeological and Paleontological Heritage of Catalonia,unique identifier for Archaeological and Paleontological Heritage in Catalonia
5958,Women's Japan Basketball League ID,Women's Japan Basketball League
5959,V.Premier League ID (obsolete),"identifier for profile of player on V.League old site. For identifier on new site, use P6527 (for male player) or P6528 (for female player)"
5960,Japan Professional Basketball League ID,Japan Professional Basketball League
5961,depicted part,"use as qualifier for ""depicts"" (P180)"
5962,sail emblem,image of figure placed on the sail of sailing boats to mark the boat type
5963,Elsevier journal ID,ID for a journal published by Elsevier
5964,Norwegian Nationaltheatret actor ID,identifikator for an actor at the Norwegian national theatre
5965,LUBW Protected Area No,unique number of a protected area in the German state of Baden-Württemberg
5966,SAGE journal ID,ID for a journal published by SAGE
5967,reference vocabulary,the controlled vocabulary used to supply the form in which the value of a statement was given in the source being referenced
5968,CPPAP ID,"ID issued by the French ""Commission paritaire des publications et des agences de presse"" for a registered periodical"
5969,RBF player ID,identifier for a baketball player at the Russian Basketball Federation website
5970,Medierådet rating,rating of a film in the Danish movie content rating system
5971,Europe PlayStation Store ID,identifier for a game available on the PlayStation Store (EU region)
5972,translation,word in another language that corresponds exactly to this meaning of the lexeme
5973,synonym,"sense of another lexeme with the same meaning as this sense, in the same language"
5974,antonym,"sense of a lexeme with the opposite meaning to this sense, in the same language"
5975,troponym of,this verb describes more narrowly the action of the more general verb used as value
5976,false friend,word in another language whose spelling is almost identical but whose meaning is different
5977,Wikidata property example for senses,"example where this Wikidata property is used; target sense is one that would use this property, with qualifier the property being described given the associated value"
5978,classifier,classifier word used with this sense
5979,Sandbox-Sense,"sandbox property for value of type ""sense"""
5980,derived from sense,"qualifier to indicate the sense for ""derived from"" (P5191) or ""compound of"" (P5238)"
5981,Encyclopedia Virginia ID,identifier of a topic in the online Encyclopedia Virginia
5982,annual number of weddings,number of marriages per year in a location
5983,Springer journal ID,Springer journal number
5984,APNI ID,"identifier for a plant, in the Australian Plant Name index"
5985,Literaturaren Zubitegia ID,Armiarma basque literature on-line database identifier
5986,Getty Iconography Authority ID,identifier from the Getty Iconography Authority
5987,Indiancine.ma film ID,identifier for a film (movie) in the Indiancine.ma archive of Indian film
5988,Deezer show ID,identifier for a show or podcast on Deezer
5989,Indiancine.ma person ID,"identifier for a person, in the Indiancine.ma archive of Indian film"
5990,Movies Anywhere ID,identifier for a film on the Movies Anywhere service
5991,carbon footprint,"Total emissions caused by an individual, event, organisation, or product, expressed as carbon dioxide equivalent. Has to be calculated via a scientificly proven methodology."
5992,attenuation coefficient,"Characterizes how easily a volume of a material can be penetrated by a beam of light, sound, particles, or other energy or matter. Beam type is to be secified using P1013."
5993,compressive modulus of elasticity,the ratio of mechanical stress to strain in an elastic material when that material is being compressed
5994,recycling code,"used to identify the material from which an item is made, to facilitate easier recycling or other reprocessing"
5995,kit supplier,official supplier of sports goods to a given club or a national sports team
5996,category for films in this language,link to category entity contains films in this language
5997,stated in reference as,"for use in a reference section, to indicate how the object of the statement was stated in reference, if this is different to how the object of statement would have been referred to in the statement's original context"
5998,distributary,stream that branches off and flows away from the river
5999,Japan PlayStation Store ID,identifier for a game available on the PlayStation Store (JP region)
6000,water footprint,total volume of fresh water used to produce the goods and services consumed by the individual or community or produced by the business
6001,applies to people,"qualifier to a specific group of people, members of a group or organization"
6002,WikiArt ID,entry of a people or artwork at WikiArt
6003,Center for Biological Diversity ID,identifier for a taxon on the Center for Biological Diversity website
6004,Brasiliana Iconográfica ID,"identifier for an artwork, in the ""Brasiliana Infográfica"" database"
6005,Muck Rack journalist ID,identifier for a journalist at the website Muck Rack
6006,Museum Universe Data File ID,"IMLS identifier for a museum, in the United States' 'Museum Universe Data File' (MUDF)"
6007,Salons ID,"identifier for an artwork, in the Paris Salons database"
6008,Agoda hotel ID,identifier for an hotel on the Agoda website
6009,Techopedia ID,identifier for an entry in the techopedia.com technology dictionary
6010,Encyclopedia of Alabama ID,identifier for a subject on the Encyclopedia of Alabama website
6011,Internet Pinball Database ID,identifier for pinball machines at the Internet Pinball Database
6012,California Office of Historic Preservation ID,identifier for a point of interest on the website of the Office of Historic Preservation of California
6013,Encyclopedia of Appalachia ID,identifier for a subject on the Encyclopedia of Appalachia website
6014,flexural strain at break,the strain of material specimen after break in a flexural test
6015,Handbook of Texas ID,identifier for a subject in the Handbook of Texas Online
6016,Tennessee Encyclopedia ID,identifier for a subject on the Tennessee Encyclopedia website
6017,CanalPlan AC place ID,"identifier for a feature on or near a British canal, in the CanalPlan AC database"
6018,SeaLifeBase ID,identifier for a taxon on the SeaLifeBase website
6019,Species at Risk public registry ID,identifier for a taxon on the Canadian 'Species at Risk' public registry website
6020,d'Art d'Art ! ID,identifier for an artwork on the d'Art d'Art ! website
6021,Hymenoptera Online taxon ID,identifier for a taxon on the Hymenoptera Online website
6022,"expression, gesture or body pose","qualifier on ""depicts"" (P180) for human position of an individual in an artwork"
6023,ResearchGate contributor ID,identifier for a non-registered author on ResearchGate
6024,Clé des langues ID,identifier for an author on 'La Clé des langues'
6025,Oiseaux.net ID,identifier for a bird taxon on the Oiseaux.net website
6028,Hypericum MySpecies ID,identifier for a taxon in the database at Hypericum MySpecies
6030,ECOS ID,identifier for a taxon on the United States' 'Environmental Conservation Online System' website
6032,IGF entrant ID,identifier of an entrant in the Independent Games Festival
6033,CMS ID,identifier for a taxon on the 'Convention on the Conservation of Migratory Species of Wild Animals' website
6034,Plant Finder ID,"identifier for a taxon in Plant Finder, on the Missouri Botanical Garden website"
6035,C.V. Starr Virtual Herbarium ID,identifier for a taxon on the Steere Herbarium website
6036,Wild Herps ID,identifier for a taxon on the Wild Herps website
6037,ProsopoMaths ID,identifier for a mathematician on Prosopomaths
6038,AFAS author ID,identifier for an author on the prosopographical website of the 'Association française pour l'avancement des sciences'
6039,Australian Faunal Directory ID,identifier for a taxon on the Australian Faunal Directory website
6040,BirdLife Australia ID,identifier for a species on the BirdLife Australia website
6041,John J. Audubon's Birds of America ID,identifier for a taxon in John J. Audubon's 'Birds of America' on the National Audubon Society website
6042,Echinoid Directory ID,identifier for a taxon on the Echinoid Directory website
6043,Espèces Envahissantes Outre-mer ID,identifier for a species on the Espèces Envahissantes Outre-mer website
6044,FEIS ID,identifier for a taxon on the Fire Effects Information System website
6045,Global Raptor Information Network ID,identifier for a taxon on the Global Raptor Information Network website
6046,MNHN taxon ID,identifier for a taxon on the Muséum national d'histoire naturelle website
6047,Neotropical Birds ID,identifier for a taxon on the Neotropical Birds website
6048,New Zealand Birds Online ID,identifier for a species on the New Zealand Birds Online website
6049,NOAA Fisheries Species Directory ID,identifier for a species on the NOAA Fisheries website
6050,OSF Online ID,identifier for a taxon on the Orthoptera Species File Online website
6051,Sea Slug Forum ID,identifier for a taxon on the Sea Slug Forum website
6052,Cockroach Species File ID,identifier for a taxon on the Cockroach Species File website
6053,Coreoidea Species File ID,identifier for a taxon on the Coreoidea Species File website
6054,GT IBMA ID,identifier for a species on the Groupe de travail Invasions biologiques en milieux aquatiques website
6055,Mantodea Species File ID,identifier for a taxon on the Mantodea Species File website
6056,Red List of South African Plants ID,identifier for a species on the Red List of South African Plants website
6057,Systematic Catalog of Culicidae ID,identifier for a taxon at the Systematic Catalog of Culicidae
6058,Larousse ID,identifier for a subject on the 'Encyclopédie Larousse'
6059,Biographie vosgienne ID,identifier for a person on 'Biographie vosgienne
6060,MoEML ID,"ID for a place, person, organisation, or work at the Map of Early Modern London project of the University of Victoria, Canada"
6061,Plant Parasites of Europe ID,identifier for a taxon at the Plant Parasites of Europe database
6062,Scoresway baseball person ID,identifier for a baseball person at the Scoresway
6063,Scoresway basketball person ID,identifier for a basketball person at the Scoresway
6064,Scoresway ice hockey person ID,identifier for a ice hockey person at the Scoresway
6065,Scoresway rugby person ID,identifier for a rugby person at the Scoresway
6066,Scoresway volleyball person ID,identifier for a volleyball person at the Scoresway
