id, label, description
2068,thermal conductivity,property of a material that describes how efficiently heat is conducted
2069,magnetic moment,torque a particle will experience in an external magnetic field
2070,Fellow of the Royal Society ID,Fellow ID of the Royal Society
2071,Mémoire des hommes ID,French government database indexing all french soldier war casualties
2072,CDB Chemical ID,ID in UCI chemical database
2073,vehicle range,distance a vehicle can travel without refuelling
2074,internetmedicin.se ID,ID in the Swedish database about medical topics
2075,speed of sound,speed of sound waves in a material. Use qualifiers to specify the measurement conditions.
2076,temperature,qualifier to indicate at what temperature something took place
2077,pressure,qualifier to indicate at what pressure something took place
2078,user manual link,"link to the user manual of the object (product, program)"
2079,fabrication method,"method, process or technique used to grow, cook, weave, build, assemble, manufacture the item"
2080,AcademiaNet ID,identifier in the AcademiaNet database for excellent female scientists
2081,BLDAM object ID,"Object ID to identify cultural heritage monuments in Brandenburg state, Germany"
2082,M.49 code,United Nations M.49 code for the subject item
2083,Leadscope ID,identifier for a chemical compound in leadscope.com
2084,ZINC ID,identifier for a chemical compound in the ZINC database
2085,Nikkaji ID,identifier for a chemical compound in the Japan Chemical Substance Dictionary (Nikkaji)
2086,CDD Public ID,identifier for a chemical compound in the Collaborative Drug Discovery database
2087,Crunchbase person ID,"Identifier for a person, in the Crunchbase database of companies and start-ups, operated by TechCrunch"
2088,Crunchbase organization ID,"Identifier for an organization, in the Crunchbase database of companies and start-ups, operated by Oath Tech"
2089,Library of Congress JukeBox ID,identifier in the Library of Congress JukeBox database of singers
2090,Power of 10 athlete ID,identifier for an athlete in the Power of 10 database
2091,FISA rower ID,identifier for a rower in the database of the International Rowing Federation (FISA)
2092,Bildindex der Kunst und Architektur ID,property for Bildindex
2093,author name string,string to store unspecified author name for publications; use if Wikidata item for author (P50) does not exist or is not known
2094,competition class,"official classification by a regulating body under which the subject (events, teams, participants, or equipment) qualifies for inclusion"
2095,co-driver,rally team member who performs as a co-driver or co-pilot
2096,media legend,"qualifier to describe the media of the statement. This avoids legend storage in the local infobox when the media is defined at Wikidata. For the date, use P585 instead."
2097,term length of office,length of time in years (unit: Q577) a person (usually a politician) is to serve in a particular office. Do not add bounds.
2098,substitute/deputy/replacement of office/officeholder,function that serves as deputy/replacement of this function/office (scope/conditions vary depending on office)
2099,BC Geographical Names ID,Unique ID of the BC Geographical Names
2100,Banque de noms de lieux du Québec ID,unique identifier for geographical names in Quebec
2101,melting point,melting point is the temperature at which a solid changes its state from solid to liquid at atmospheric pressure
2102,boiling point,temperature at which a substance changes its phase from liquid to gas (indicate the corresponding pressure as qualifier)
2103,size of team at start,number of players/sled dogs/etc. in a team at the start of a match or race
2105,size of team at finish,number of players/sled dogs/etc. in a team at the end of the race or match
2106,RXNO Ontology,RSC ontology for organic reactions
2107,decomposition point,decomposition point of a substance
2108,Kunstindeks Danmark artwork ID,identifier for artwork in the Danish art database
2109,installed capacity,power produced by the engine or plant (use with unit of power)
2112,wing area,area of an aircraft's wing surfaces
2113,sublimation temperature,temperature at which a substance changes directly from solid to gaseous (indicate corresponding pressure qualifier)
2114,half-life,time required for the amount of something to fall to half its initial value
2115,NDF-RT ID,identifier for the National Drug File Reference Terminology
2116,enthalpy of vaporization,vaporization enthalpy of a substance with temperature as qualifier
2117,combustion enthalpy,enthalpy difference of a substance for combustion
2118,kinematic viscosity,"viscosity of a substance, with phase of matter (P515) and temperature (P2076) as qualifiers"
2119,vapor pressure,pressure exerted by a vapor in thermodynamic equilibrium with its condensed phases
2120,radius,distance between the center and the surface of a circle or sphere
2121,prize money,amount in a specific currency
2123,YerelNet village ID,"identifier for a village, in YerelNet.org.tr, which contains detailed informations about all villages in Turkey"
2124,member count,number of people who are part of an organization at a particular time
2125,Revised Hepburn romanization,romanized Japanese following the Revised Hepburn romanization system
2126,Georgian national system of romanization,
2127,International Nuclear Event Scale,
2128,flash point,lowest temperature at which it can vaporize to form an ignitable mixture in air. Add qualifier for measurement method (P459): open cup or closed cup. Not equal to fire point.
2129,IDLH,Immediately Dangerous to Life and Health value
2130,cost,amount of money spent on building or producing an object
2131,nominal GDP,market value of all officially recognized final goods and services produced within a country in a given period of time
2132,nominal GDP per capita,country's total GDP divided by the population
2133,total debt,"amount of debt for a company, organization or public entity"
2134,total reserves,"total reserves comprise holdings of monetary gold, special drawing rights, reserves of IMF members held by the IMF, and holdings of foreign exchange under the control of monetary authorities"
2135,total exports,amount of goods and services sold to other countries
2136,total imports,amount of goods and services bought from other countries
2137,total equity,amount of equity value for an entity
2138,total liabilities,total liabilities for a corporation or entity
2139,total revenue,income gained by an organization during a given time frame. not to be confused with fiscal revenue
2140,foreign direct investment net outflow,"net outflow of equity capital, reinvestment of earnings, other long-term capital, and short-term capital"
2141,foreign direct investment net inflow,"net inflow of equity capital, reinvestment of earnings, other long-term capital, and short-term capital"
2142,box office,box office takings accumulated by a film
2143,genome size,size of the genome in base pairs
2144,frequency,"frequency in Hz at which the subject works, for example the frequency a radio station can be received"
2145,explosive energy equivalent,amount of energy discharged during an explosion
2146,orbital period,the time taken for a given astronomic object to make one complete orbit about another object
2147,rotation period,the time that astronomic objects takes to complete one revolution around its axis of rotation
2148,distance from river mouth,qualifier for P974 statements on streams
2149,clock speed,CPU clock frequency
2150,FSB speed,CPU front-side bus speed
2151,focal length,"focal length of lens (telescope, etc.)"
2152,antiparticle,particle with the same rest mass and opposite charges
2153,PubChem Substance ID (SID),"substance (e.g. mixtures, undefined stereochemistry, ...) identifier in the PubChem database."
2154,binding energy,energy required to disassemble a whole system into separate parts
2155,solid solution series with,"the mineral forms a continous (true) or discontinous ""solid solution series"" with another mineral"
2156,pseudo crystal habit,"possible macrosopic appearance of a crystal different to its molecular symmetry (crystal cell, specimens with twinning or synthetic material)"
2157,lithography,structure size (as advertised or listed) of a microchip
2158,Cell Line Ontology ID,identifier for the Cell Line Ontology which describes anatomic origin and nature of eukaryotic cell lines
2159,solves,problem that this algorithm or method solves
2160,mass excess,difference between its actual mass and its mass number in atomic mass units
2161,Guthrie code,Guthrie code of a Bantu language
2162,Deutsche Ultramarathon-Vereinigung ID,identifier for individual runners in the Deutsche Ultramarathon-Vereinigung (German Ultramarathon Association) database
2163,FAST ID,authority control identifier in WorldCat's “FAST Linked Data” authority file
2164,SIGIC author ID,SIGIC - Slovenian Music Information Center (property for author/person)
2165,SIGIC group ID,SIGIC - Slovenian Music Information Center (property for music group)
2166,SIGIC institution ID,SIGIC - Slovenian Music Information Center (property for institution)
2167,UNSPSC Code,identifier for taxonomy of products and services for use in eCommerce
2168,Swedish Film Database person ID,identifier for a person on the Swedish Film Database (SFDb)
2169,PublicWhip ID,identifer in the PublicWhip database of British MPs
2170,Hansard (2006–March 2016) ID,identifier for a British MP in Hansard (2006–March 2016)
2171,TheyWorkForYou ID,identifier in the 'TheyWorkForYou' database of British MPs
2172,Parliamentary record identifier,Parliamentary record identifier for British MPs
2173,BBC News Democracy Live ID,Identifer in the BBC News Democracy Live database of British MPs
2174,Museum of Modern Art artist ID,identifier assigned to an artist by the Museum of Modern Art
2175,medical condition treated,"disease that this pharmaceutical drug, procedure, or therapy is used to treat"
2176,drug used for treatment,"drug, procedure, or therapy that can be used to treat a medical condition"
2177,solubility,property of a chemical to dissolve in another chemical forming a solution. Provide solvent (P2178) and temperature (P2076) as qualifiers
2178,solvent,qualifier to show which substance is the solvent in a solution-process (use with p2177)
2179,ACM Classification Code (2012),ACM Computing Classification Code of 2012 (8 digits)
2180,Kansallisbiografia ID,code of the entry on the Kansallisbiografia database
2181,Finnish MP ID,code of the entry on the Finnish parliament database
2182,Finnish Ministers database ID,code of the entry on the Finnish ministers database
2183,ISO 9:1995,the Latin transliteration of Cyrillic text (used as qualifier)
2184,history of topic,historical development of an item's topic
2185,DLI ID,"identifier for a work, in the Digital Library of India"
2186,Wiki Loves Monuments ID,unique ID for the monuments included in Wiki Loves Monument's national lists
2187,BiblioNet publication ID,identifier in the BiblioNet database of book editions
2188,BiblioNet author ID,"Identifier in the BiblioNet database of authors, created by the National Book Centre of Greece, many Greek individual publishers and their professional associations"
2189,BiblioNet publisher ID,identifier in the BiblioNet database of publishers
2190,C-SPAN person ID,identifier for a person's appearances on C-SPAN
2191,NILF ID,numeric identifier within the Vegetti Catalog of Fantastic Literature
2192,endangeredlanguages.com ID,identifier of a language on the website endangeredlanguages.com
2193,Soccerbase player ID,player ID on the Soccerbase.com website
2194,PSS-Archi architect id,identifier for an architect in the PSS-archi database
2195,Soccerbase manager ID,manager ID on the Soccerbase.com website
2196,students count,number of students of any type in an educational organization
2197,production rate,amount of produced in a given time
2198,average gradient,gradient expressed as a percentage (between 0 and 1)
2199,autoignition temperature,lowest temperature at which it will spontaneously ignite in a normal atmosphere without an external source of ignition
2200,electric charge,electric charge of a subatomic particle
2201,electric dipole moment,
2202,lower flammable limit,the lower bound of the concentration range over which a flammable mixture of gas or vapour in air can be ignited at a given temperature and pressure (0-1)
2203,upper flammable limit,upper bound of the concentration range over which a flammable mixture of gas or vapour in air can be ignited at a given temperature and pressure (0-1)
2204,minimum explosive concentration,minimum concentration at which a chemical can explode
2205,Spotify album ID,identifier for an album or single on Spotify
2206,Discogs release ID,"identifier for a musical work (release) in the Discogs database, if there is no master ID (P1954)"
2207,Spotify track ID,Identifier for a track on Spotify
2208,average shot length,cinemetrical measure
2209,SourceForge project,"identifier for an official SourceForge repository (""project"") for a software product"
2210,relative to,qualifier: what a statement value is relative to
2211,position angle,measurement relating to observed visual binary stars (use with P2210)
2212,angular distance,size of the angle between the two directions originating from the observer and pointing towards these two objects (use with P2210)
2213,longitude of ascending node,property of one of the orbital elements used to specify the orbit of an object in space
2214,parallax,parallax of nearest stars
2215,proper motion,proper motion of a star
2216,radial velocity,component of the object's velocity that points in the direction of the radius connecting the object and the point
2217,cruise speed,design cruise speed
2218,net worth,estimated totality of wealth possessed by a person
2219,real gross domestic product growth rate,percentage change in nominal GDP from one year to the next minus the inflation rate
2220,household wealth,net worth of consumers
2221,flux,the observed flux in a particular wavelength band of an astronomical object
2222,gyromagnetic ratio,characteristic property of any elementary particle
2223,decay width,characteristic property of any elementary particle
2225,discharge,volume rate of water flow which is transported through a given cross-sectional area
2226,market capitalization,total value of issued shares by a publicly traded company
2227,metallicity,abundance of elements that are heavier than hydrogen or helium in an astronomical object
2228,maximum thrust,maximum thrust specified for a jet engine
2229,thermal design power,potency in Watts
2230,torque,"torque of a machine, a motor/engine/powerplant, or a vehicle"
2231,explosive velocity,
2232,cash,the value of cash and securities held by a state government
2233,semi-major axis of an orbit,semi-major axis of a stable orbit (Astronomy)
2234,volume as quantity,quantity of three-dimensional space
2235,external superproperty,all resources related by this property are also related to that property from an external vocabulary
2236,external subproperty,all resources related by the property from external vocabularies are also related to this property
2238,official symbol,official symbol of administrative entities
2239,first aid measures,"actions to take to help a person in the case of accidents, injuries and accidental exposures to harmful chemicals"
2240,median lethal dose,the dose required to kill half the members of a tested population after a specified test duration (LC₅₀ → P2712)
2241,reason for deprecation,qualifier to allow the reason to be indicated why a particular statement should be considered deprecated
2242,Florentine musea catalogue ID,identifier for artworks from the catalogue of the national Florentine musea
2243,apoapsis,"distance, at which a celestial body is the farthest to the object it orbits"
2244,periapsis,"distance, at which a celestial body is the closest to the object it orbits"
2248,argument of periapsis,angle from the body's ascending node to its periapsis
2249,Refseq Genome ID,ID in the RefSeq Genome database
2250,life expectancy,life expectancy for this group or species
2252,National Gallery of Art artist ID,"identifier assigned to an artist by the National Gallery of Art in Washington, DC"
2253,DfE URN,Department for Education Unique Reference Number; school identifier used by the UK government
2254,maximum operating altitude,ceiling or maximum density altitude at which an aircraft can operate
2255,Debrett's People of Today ID,"identifier for a person, in Debrett's ""People of Today"""
2257,time period of periodically occurring event,"standard nominal interval between scheduled or regularly recurring events. Include unit of time, e.g. ""year"" (Q577)"
2258,mobile country code,identifier for countries in ITU-T Recommendation E.212 for use in describing mobile networks
2259,mobile network code,code for mobile networks defined by ITU-T Recommendation E.212
2260,ionization energy,"minimum amount of energy required to remove an electron from an atom, ion or molecule in the gaseous state"
2261,beam,width of a ship at its widest point measured at its nominal waterline
2262,draft,depth below the water line to the bottom of a vessel's hull
2263,ISOCAT id,numeric ID from the Data Category Registry
2264,mix'n'match catalogue ID,ID of the catalogue corresponding to the property in the mix'n'match tool
2266,FMD model ID,external link to a model's profile at the FMD (Fashion Model Directory) website
2267,PolitiFact Personality ID,person or group whose statements have been fact checked by PolitiFact.com
2268,Musée d'Orsay artist ID,numeric ID for an artist in the Répertoire des artistes documentation database of the Orsay Museum
2270,Emporis building complex ID,"identifier for a building complex, as opposed to a single building, in the Emporis architecture database"
2271,Wikidata property example for properties,"if the example entity is a property, not an item"
2272,Hederich encyclopedia article ID,"entry in Hederich’s encyclopedia of mythology, 3rd edition (1770), via zeno.org"
2273,Heidelberg Academy for Sciences and Humanities member ID,entry in the list of members of the Heidelberg Academy for Sciences and Humanities
2275,World Health Organisation International Nonproprietary Name,identifier for a drug
2276,UEFA player ID,identifier for UEFA players
2277,Magdeburger Biographisches Lexikon,biographical article about people from the Magdeburg area
2278,Member of the Hellenic Parliament ID,"an identifier for members, or former members, of the national parliament of Greece"
2279,ambitus,musical interval/range of a melody
2280,Austrian Parliament ID,"identifier for an individual, in the Austrian Parliament's ""Who's Who"" database"
2281,Apple Music album ID,identifier for a musical work in the iTunes website
2282,Groeningemuseum work PID,"persistent identifier for an artwork from the collection of the Groeningemuseum in Bruges, Belgium"
2283,uses,item or concept used by the subject or in the operation (see also instrument [P1303] and armament [P520])
2284,price,published price listed or paid for a product (use with unit of currency)
2285,periapsis date,time for perihelim/perigeum in each orbit for an astronomical object
2286,arterial supply,arterial supply of an anatomical structure
2287,CRIStin ID,ID in the database for Norwegian scientists
2288,lymphatic drainage,lymphatic drainage of an anatomical structure
2289,venous drainage,vein draining the anatomical structure
2290,Danish parish code,identifier for an parish in Denmark
2291,charted in,chart where the element reached a position
2292,consumption rate,rate at which a product is consumed
2293,genetic association,"general link between a disease and the causal genetic entity, if the detailed mechanism is unknown/unavailable"
2294,balance of trade,exports minus imports. not to be confused with current account balance and balance of payments
2295,net profit,private entity profit
2296,money supply,"amount of currency the central bank has injected in the economy (MO, M1, M2, M3)"
2297,employment by economic sector,employment divided by sector
2298,NSDAP membership number (1925–1945),
2299,PPP GDP per capita,GDP divided by the population total and adjusted for CPI
2300,minimal lethal dose,lowest concentration of a toxic substance in an environmental medium that kills individual organisms or test species under a defined set of conditions
2302,property constraint,constraint applicable to this Wikidata property
2303,exception to constraint,"item that is an exception to the constraint, qualifier to define a property constraint in combination with P2302"
2304,group by,qualifier to define a property constraint in combination with P2302 (Wikidata property constraint)
2305,item of property constraint,qualifier to define a property constraint in combination with P2302
2306,property,"qualifier to define a property constraint in combination with P2302 (property constraint), or to limit the scope of Q44292881 (wikidata statement)"
2307,namespace,qualifier to define a property constraint in combination with P2302 (Wikidata property constraint)
2308,class,qualifier to define a property constraint in combination with P2302
2309,relation,"qualifier to define a property constraint in combination with P2302. Possibly values are: ""instance of"", ""subclass of"" or ""instance or subclass of"". The qualifier to use with the property ""relative"" is ""type of kinship"" (P1039), not this."
2310,minimum date (property constraint),qualifier to define a property constraint in combination with P2302
2311,maximum date (property constraint),"qualifier to define a property constraint in combination with P2302. Use ""unknown value"" for current date."
2312,maximum value,"qualifier to define a property constraint in combination with P2302. ""no value"" can be used to specify no upper bound"
2313,minimum value,qualifier to define a property constraint in combination with P2302
2315,comment (DEPRECATED),"to be deleted: replace with ""syntax clarification"" (P2916) or add the usage note in the items description."
2316,constraint status,"qualifier to define a property constraint in combination with P2302. Use values ""mandatory constraint"" or ""suggestion constraint"""
2317,call sign,short form identifier for a radio operator or broadcaster and (as flag signal) previous for watercrafts
2318,debut participant,participant for whom this is their debut appearance in a series of events
2319,elector,people or other entities which are qualified to participate in the subject election
2320,aftershocks,number of smaller earthquakes which follow a significant earthquake
2321,general classification of race participants,classification of race participants
2322,article ID,identifier for an article in an online publication
2323,Swedish Olympic Committee athlete ID,"entry in the bibliographic database of the Swedish Olympic Committee (Swedish: Sveriges Olympiska Kommitté, SOK)"
2324,quantity buried,number of remains buried or interred
2325,mean anomaly,element of orbital definition
2326,GNS Unique Feature ID,identifier for geographic entities according to the National Geospatial-Intelligence Agency's GEOnet Names Server
2327,ProCyclingStats race ID,
2328,ProCyclingStats team ID,
2329,antagonist muscle,
2330,Cycling Archives race ID,identifier in the Cycling Archives
2331,Cycling Archives team ID,identifier in the Cycling Archives
2332,Dictionary of Art Historians ID,identifier for a person in the Dictionary of Art Historians
2333,Norwegian organisation number,"organisation's purely numerical identifier in the Norwegian ""Central Coordinating Register for Legal Entities"""
2334,Swedish Film Database film ID,identifier for a movie on the Swedish Film Database (SFDb)
2335,Swedish Film Database company ID,company identifier in the Swedish Film Database (SFDb)
2336,Swedish Film Database soundtrack ID,soundtrack identifier in the Swedish Film Database (SFDb)
2337,Swedish Film Database group ID,group identifier in the Swedish Film Database (SFDb)
2338,Musopen composer ID,identifier for a composer in the musopen.org database
2339,BoardGameGeek ID,identifier for a board game in the BoardGameGeek database
2340,CESAR person ID,identifier for a person in the CESAR database of French theatre of the seventeenth and eighteenth centuries
2341,indigenous to,"area or ethnic group that a language, folk dance, cooking style, food or other cultural expression is found (or was originally found)"
2342,AGORHA person/institution ID,identifier for a person or institution in the Agorha database (INHA)
2343,playing range image,image showing the playing range of the instrument
2344,AGORHA work ID,Identifier for historical art resources
2345,AGORHA event identifier,
2346,Elonet movie ID,identifier for a movie in the Elonet database
2347,YSO ID,identifier for a concept in the General Finnish Upper Ontology YSO
2348,time period,"time period (historic period or era, sports season, theatre season, legislative period etc.) in which the subject occurred"
2349,Stuttgart Database of Scientific Illustrators ID,"identifier for a person, in the University of Stuttgart's Database of Scientific Illustrators, 1450–1950"
2350,SpeedSkatingBase.eu ID,identifier for a speed skater in the Speedskatingbase.eu database with personal best distance records
2351,number of graves,number of burial places In a cemetery or necropolis
2352,applies to taxon,"qualifier for toxicological concentrations and doses, indicates species in which the drug was tested"
2353,statistical unit,member of a dataset
2354,has list,Wikimedia list related to this subject
2355,UNESCO Atlas of the World's Languages in Danger ID,identifier for endangered languages listed by UNESCO
2357,Classification of Instructional Programs code,code representing academic disciplines in the U.S. Department of Education's Classification of Instructional Programs
