id, label, description
4007,DBS ID,identifier in the German/Austrian Library Statistics (DBS/ÖBS)
4008,Early Aviators people ID,"identifier for a person by Early Birds of Aviation, at www.earlyaviators.com"
4009,RKY national built heritage environment ID,identifier in the national built heritage environments listing RKY
4010,GDP (PPP),gross domestic product (GDP) at purchasing power parity (current international $)
4011,Semantic Scholar paper ID,identifier for an article in the Semantic Scholar database
4012,Semantic Scholar author ID,identifier for an author in the Semantic Scholar database
4013,Giphy username,this item's username on Giphy
4014,Australian Statistical Geography 2011 ID,identifier of a geographic region defined in the Australian Statistical Geography Standard 2011
4015,Vimeo username,this item's username on Vimeo
4016,SlideShare username,this item's username on SlideShare
4017,Ustream username,this item's username on Ustream
4018,The Arabidopsis Information Resource Accession,"Identifier for an object (e.g. clone, gene, genetic marker, sequence, etc.) in TAIR"
4019,USL Championship player ID,"identifier for soccer player profile on website of USL Championship, formerly known as United Soccer League (USL) and USL Pro"
4020,ISQ dimension,"property of an observable physical quantity being a product of the SI base dimensions (length, mass, time, etc.)"
4021,danskefilm animated film ID,identifier for a animated film in danskefilm.dk
4022,danskefilm TV series ID,identifier for a TV serie in danskefilm.dk
4023,DFB datacenter player ID,"identifier for players, manager and referees in the datacenter of the German Football Association (''Deutscher Fußball-Bund'', DFB)"
4024,ADW taxon ID,"identifier for a taxon, in the Animal Diversity Web database"
4025,Pinakothek artist ID,identifier in the Pinakothek collection
4026,Cullum number,identifier for a graduate of the US Military Academy (West Point)
4027,National Discography of Italian Song work ID,identifier for a musical work in National Discography of Italian Song website
4028,Google Scholar paper ID,identifier for a paper in Google Scholar
4029,Latvian Protected Nature Territory ID,identifier for geographical territories under special state-level protection in Latvia
4030,PLU code,"identification numbers affixed to fruits and vegetables for sale, used in checkout and inventory"
4031,Hungarian NGO ID,registration number for Hungarian NGO
4032,reviewed by,"person who reviewed/refereed the work, e.g., scientific peer-reviewer"
4033,Mastodon address,address on the Mastodon decentralized social network. The form is: 'user@server.domain' there is no leading '@' as sometimes written to distinguish Mastodon addresses from email addresses.
4034,Shironet artist ID,ID of an artist in the israeli Shironet database
4035,Shironet song ID,"ID of a song in the israeli database for lyrics, Shironet"
4036,field of view,extent of the observable world that can be seen or sensed by the item
4037,South Australian Heritage Register Database ID,"identifier for a place with recognised heritage value, in South Australia's heritage database"
4038,Danish List of Lights and Fog signals ID,"identifier in the Danish List of a Lighthouse, beacon or fog signal in the Kingdom of Denmark"
4040,Rock.com.ar artist ID,identifier for an artist at Rock.com.ar
4041,Rock.com.ar album ID,identifier for an album at Rock.com.ar
4042,ESBL athlete ID,identifier for a sportsperson in the Estonian sportsbiographical lexicon
4043,emulates,"emulates the identified platform, CPU, or system"
4044,therapeutic area,disease area in which a medical intervention is applied
4045,Sandbox-Tabular data,A sandbox type per available data type
4046,SIMC place ID,identifer for places in Poland in the SIMC system run by the Polish Central Statistical Office
4047,Sandbox-Geographic shape,A sandbox type per available data type
4048,J.League manager ID,"identifier for a manager (coach) at website of J.League, Japan's professional association football (soccer) league"
4050,French Olympic Committee athlete ID,identifier for a French athlete on the French Olympic Committee's EspritBleu website
4051,Ukrainian regulations base ID,identifier in the Verkhovna Rada database of laws and regulations of Ukraine
4052,Academia.edu institutional ID,academic institution page on academia.edu
4053,German Olympic Sports Confederation athlete ID,identifier for a German athlete on the German Olympic team's website
4054,Canadian Olympic Committee athlete ID,"identifier for a Canadian athlete at Olympic.ca, the official website of the Canadian Olympic Committee"
4055,Norwegian List of Lights ID,identifier of lighthouses and beacons in the Norwegian List of Lights issued by the Norwegian Coastal Administration
4056,New Zealand Olympic Committee athlete ID,identifier for a Kiwi athlete on the New Zealand Olympic Committee website
4057,Irish Sites and Monuments Record ID,identifier in Sites and Monuments Record database of Ireland
4058,FINESS medical facility ID,identifier of a medical facility in France in the FINESS directory
4059,Irish National Monument ID,"identifier of a structure, in National Monument database of Ireland, maintained by Heritage Ireland"
4060,Brazilian Olympic Committee athlete ID,identifier for a Brazilian athlete at the Brazilian Olympic Committee (Portuguese: Comitê Olímpico do Brasil) website
4061,Lithuanian National Olympic Committee athlete ID,"identifier for athlete on website of the Lithuanian National Olympic Committee (in Lithuanian: Lietuvos tautinis olimpinis komitetas, LTOK)"
4062,Czech Olympic Committee athlete ID,identifier for a Czech athlete on the website of the Czech Olympic Committee (Český olympijský výbor – ČOV)
4063,United States Olympic Committee athlete ID,identifier for an American athlete at the United States Olympic Committee (USOC) TeamUSA.org website
4065,Argentine Olympic Committee athlete ID,identifier for an Argentine athlete on the website of the Argentine Olympic Committee (Comité Olímpico Argentino)
4066,Hungarian Olympic Committee athlete ID,identifier for an athlete on the website of the Hungarian Olympic Committee
4067,Romanian Olympic and Sports Committee athlete ID,identifier for an athlete on the website of the Romanian Olympic and Sports Committee
4068,Chinese Olympic Committee athlete ID,identifier for a Chinese athlete at the Chinese Olympic Committee's CIS Chinese Athletes Database website
4069,Italian National Olympic Committee athlete ID,identifier for an Italian athlete on the website of the Italian National Olympic Committee
4070,identifier shared with,"qualifier, to be used on external identifier IDs, indicating another Wikidata item is also matched to this ID"
4071,Zemereshet artist ID,"identifier for an artist in the Israeli database for lyrics, Zemereshet"
4072,Zemereshet song ID,"ID of a song in the israeli database for lyrics, Zemereshet"
4073,Fandom wiki ID,"identifier of a topic's wiki, in Fandom.com"
4074,FFN swimmer ID,"unique federal identifier (IUF) of a French swimmer in extraNat.fr, database of the French Swimming Federation (FFN)"
4075,Czech Monument Catalogue Number,ID given to protected but also some unprotected monuments and other objects in the Czech Republic on the official Monument Catalogue of the National Heritage Institute
4076,WorldSBK.com racer identifier,identifier for a motorcycle racer on the WorldSBK.com website
4077,Pizmonet ID,"ID of an artist or a song in the israeli database for hit parades, Pizmonet"
4078,SKIP code,kanji classification according to the System of Kanji Indexing by Patterns
4079,Theatres Trust Database ID,identifier of the Theatres Trust Database
4080,number of houses,number of houses in given territorial entity
4081,BHL creator ID,"identifier for an author (""creator"") in the Biodiversity Heritage Library database"
4082,image captured with,model of camera used to capture this visual work
4083,NPS unit ID,4-letter identifier for a U.S. National Park System unit on the website of the National Park Service
4084,MyAnimeList people ID,identifier for a person or group of people on MyAnimeList
4085,MyAnimeList character ID,identifier for a fictional character on MyAnimeList
4086,MyAnimeList anime ID,identifier for an anime on MyAnimeList
4087,MyAnimeList manga ID,identifier for a manga on MyAnimeList
4088,Irish National Inventory of Architectural Heritage ID,"identifier of a structure, in National Inventory of Architectural Heritage database of Ireland"
4089,Global Terrorism Database ID,identifier in the Global Terrorism Database by the National Consortium for the Study of Terrorism and Responses to Terrorism (START)
4090,Biodiversity Repository ID,"identifier of a repository, in the Biodiversity Repository database"
4091,Irish Grid Reference,grid location reference from the Irish Grid reference system used in Ireland
4092,checksum,"small-sized datum derived from a block of digital data for the purpose of detecting errors. Use qualifier ""determination method"" (P459) to indicate how it's calculated, e.g. MD5."
4093,Australian Statistical Geography 2016 ID,Identifier of a geographic region defined in the Australian Statistical Geography Standard 2016
4094,Australian Standard Geographic Classification 2006 ID,Identifier of a geographic region defined in the Australian Standard Geographic Classification 2006
4095,Principal Galaxies Catalogue ID,identifier for an astronomical object in the Principal Galaxies Catalogue
4096,RePEc institute ID,identifier for economics research institutions in the Research Papers in Economics (RePEc) database
4097,MuseScore ID,identifier in the MuseScore database
4098,BVMC place id,"identifier of a place on the Biblioteca Virtual Miguel de Cervantes, data.cervantesvirtual.com"
4099,metrically compatible typeface,"typeface metrically compatible with this typeface: glyph position, width and height match"
4100,parliamentary group,parliamentary group which a member of a parliament belongs to
4101,dissertation submitted to,institution to whom a thesis or dissertation is submitted
4102,Atlas of Hillforts ID,identifier in the Atlas of Hillforts database
4103,assets under management,total market value of financial assets which a financial institution manages on behalf of its clients and itself
4104,Carnegie Hall agent ID,identifier for a person or ensemble in the Carnegie Hall Linked Open Data (LOD)
4105,EGF rating,rating given by EGF (European Go Federation) to European go players
4106,Finnish archaeological heritage ID,identifier for the Archaeological heritage register for items in mainland Finland
4107,Framalibre ID,unique identifier in the Framalibre free software directory
4108,Gedbas genealogy person ID,identifier for a person in the genealogical database of the Verein für Computergenealogie e.V. on gedbas.genealogy.net
4109,URN-NBN,URI in the urn:nbn: namespace as specified by RFC 3188
4110,Crunchyroll ID,identifier for an anime or drama topic on Crunchyroll
4111,danskefilm TV Christmas calendar,identifier for a TV Christmas calendar in danskefilm.dk
4112,danskfilmogtv person ID,identifier for a person in danskfilmogtv.dk
4113,FRED time-series ID,identifier for an economic data set provided by St. Louis Fed's Federal Reserve Economic Data (FRED)
4114,ADK member ID,Akademie der Künste in Berlin member ID
4115,INSPIRE ID,"universal identifier from Infrastructure for Spatial Information in the European Community (INSPIRE), used across EU databases"
4116,JewAge person ID,"identifier for a person on JewAge, a genealogical database for Jewish people"
4117,National Record of the Historic Environment ID,identifier for a building or structure in Historic England's PastScape database
4118,NLS-FI Geographic Name ID,National Land Survey of Finland Geographic Name ID
4119,NLS Geographic Names Place ID,National Land Survey of Finland Geographic Names Register Named Place ID
4120,Ontario Heritage Act Register ID,identifier of a property listed on the Ontario Heritage Act Register
4121,openAIP ID,"identifier of an aerodrome, in the openAIP (open aeronautical information platform) database"
4122,PalDat plant ID,identifier for a plant species in the Palynological Database (PalDat) for pollen of the University of Vienna
4123,French National Assembly ID,identifier for a member of the French National Assembly on the official website (do not confuse with Sycomore ID)
4124,Who's Who in France biography ID,unique identifier in the Who's Who in France online biography dictionary
4125,Titan ID,identifier for a taxon (Cerambycidae) in the Titan database
4126,ESEC person ID,"identifier of a member of the French Economic, Social and Environmental Council"
4127,EmbassyPages.com ID,"ID of an embassy or a consulate general in the database for diplomatic missions, EmbassyPages.com"
4128,NPSN Indonesian school ID,identifier for a school in Indonesia
4129,Cinema Treasures ID,identifier for a cinema in the Cinema Treasures database
4130,USHMM person ID,"identifier for a person in the UHSMM, a database of Holocaust survivors and victims"
4131,annual energy output,annual energy output of a power plant
4132,linguistic typology,classification of languages according to their linguistic trait (as opposed to historical families like romance languages)
4133,Patrimonioculturale-ER ID,"identifier for a cultural heritage site in Emilia-Romagna region in Italy, in the Patrimonioculturale-ER open data portal"
4135,maximum age,"highest age a person is eligible to do something, for example be member in youth organisation or sport teams, or for some positions like judges"
4136,WIGOS station ID,"identifier of a meteorological station, in the WIGOS database"
4137,muzzle velocity,speed of a projectile at the moment it leaves the muzzle of a gun
4138,Treasury of Lives ID,"identifier for a person in the biographical encyclopedia of biographies related to Tibet, Inner Asia, and the Himalayan region"
4139,National Assembly of Nigeria ID,"identifier for a person on the National Assembly of Nigeria website, both for Representatives and Senators"
4140,energy storage capacity,storage capacity of a battery or energy storage system
4141,Gatehouse Gazetteer place ID,identifier for the castle sites in the Gatehouse Gazetteer website
4142,RIWAQ Registry of Historic Buildings in Palestine ID,identifier for a historic building in Palestine on the RIWAQ database
4143,Finnish List of Lights ID,"identifier of a lighthouse or beacon in the Finnish List of Lights, issued by the Finnish Transport Agency"
4144,Athenaeum artwork ID,artwork id in the Athenaeum artworks website
4145,Athenaeum person ID,artist id in the Athenaeum artworks website
4146,Athenaeum museum ID,museum or other repository/source id in the Athenaeum artworks website
4147,conjugate acid,species formed by accepting a proton (H⁺)
4149,conjugate base,species formed by losing a proton (H⁺)
4150,weather history,link to a Commons tabular data file with the weather history of a certain place
4151,game mechanics,constructs of rules or methods designed for interaction with the game state
4152,file format identification pattern,pattern or string which is used to identify a file as having a particular known format
4153,offset,"qualifier of ""magic number"" for the number of bytes before the magic number to be searched in a file"
4154,National Forest Foundation ID,identifier for an American national forest on the National Forest Foundation website
4155,separator,parameter for single-value constraint. Multiple values are allowed under that constraint if they have different values for this property.
4156,Czech Registration ID,"identifier for an organization in the Czech Republic, conferred by the Czech Statistical Office"
4157,MEG ID,ID number for the online catalogue of Musée d'ethnographie de Genève
4158,autores.ar id,identifier for an Argentinian literary author
4159,WeRelate person ID,identifier for a person in the Creative Commons-licensed genealogical database WeRelate
4160,Michelin Restaurants ID,identifier for a restaurant in the Michelin Restaurants website
4161,Michelin Voyages ID,identifier for a place in the website Michelin Voyages
4162,AUR package,indicates the official name of the package on the Arch's User Repository
4163,magnification,amount of optical magnification provided
4164,National Baseball Hall of Fame and Museum ID,identifier for a player on the United States' National Baseball Hall of Fame and Museum website
4165,CODECS ID,identifier in CODECS database for Celtic studies
4166,Georgian National Register of Monuments ID,identifier for a monument in the National Register of Monuments of Georgia
4167,Dagens Næringsliv topic ID,"identifier for a topic, used by the Norwegian daily newspaper Dagens Næringsliv"
4168,IEDB Epitope ID,identifier for an Epitope in the Immune Epitope Database
4169,YCBA agent ID,identifier for a person in the Yale Center for British Art database
4170,America's National Parks ID,identifier for a United States National Park System unit on eParks.com
4171,World Heritage Tentative List ID,identifier for a site on the UNESCO World Heritage Tentative Lists
4172,America's Byways road ID,identifier for a United States road on the America's Byways website
4173,Instagram location ID,identifier for a location on Instagram
4174,Wikimedia username,"user name of a person, across all Wikimedia projects; disclosing others' usernames violates the WMF privacy policy and may result in a block; see Wikidata:Oversight if you want to remove your information"
4175,Patreon ID,identifier for a person on Patreon
4176,effective firing range,distance within which a weapon can be used effectively
4177,Finnish National Gallery artist ID,identifier for people in the Finnish National Gallery
4178,Beazley Archive Pottery Database ID,identifier for an artefact in the Beazley Archive Pottery Database
4179,tabular population,same as population (P1082); used when there is data for many different points in time
4180,GujLit Person ID,"identifier for a person, in the GujLit database of literature of the Gujarati language of India"
4181,GujLit Book ID,"identifier for a book, in the GujLit database of literature of Gujarati language of India"
4182,National Natural Landmarks site ID,identifier an American National Natural Landmark on the United States' National Park Service website
4183,angle from vertical,angle the principal axis of an item makes with the vertical; use degree (Q28390) as unit
4184,slope,angle the surface of an item makes with the horizontal
4185,iconographic symbol,"identifying element typically depicted as accompanying or worn by this religious figure, hero, fictional or historical character"
4186,Australian Women's Register ID,identifier for a person or organisation in the Australian Women's Register
4187,Wylie transliteration,transliteration method for Tibetan
4188,Tibetan pinyin,official Chinese transliteration method for Tibetan
4189,THL Simplified Phonetic Transcription,transliteration method for Tibetan developed by the Tibetan and Himalayan Library
4190,Rivers.gov protected area ID,identifier for an American National Wild and Scenic River on the United States' Rivers.gov website
4191,Alljudo judoka ID,identifier for a judoka on the Alljudo.net website
4192,LNH player ID,identifier for a player on the Ligue Nationale de Handball (LNH) website
4193,Familypedia person ID,"identifier for a person on Familypedia, the genealogical database by Wikia"
4194,CNPS ID,identifier in the California Native Plant Society database
4195,category for employees of the organization,Wikimedia category for people who work or worked at this organization
4196,cytogenetic location,cytogenetic location of the gene or region
4197,IBM graphic character set global ID,identifier of a character set assigned by IBM
4198,Google Play Music artist ID,identifier of an artist on the Google Play Music website
4199,Google Play Music album ID,"identifier for an album, single, other music release or other publication on the Google Play Music website"
4200,Christie's creator ID,identifier for an artist in the Christie's online database
4201,PagesJaunes ID,identifier for a professional in France in the PagesJaunes website
4202,WFD Chemical status,chemical status of a Water Body in accordance with the Water Framework directive of the  European Environment Agency
4203,ROARMAP ID,identifier in the Registry of Open Access Repository Mandates and Policies
4204,The Times of India topic ID,identifier for a topic for news and information aggregation on The Times of India website
4206,FOIH person ID,identifier for a person or an organization in the database of the Flemish organization for Immovable Heritage
4207,Italian National Earthquake Center ID,identifier for an earthquake in the Italian National Earthquake Centre database
4208,Billboard artist ID,identifier for an artist at the Billboard website
4209,danskfilmogtv title ID,identifier for a film or TV episode or series in danskfilmogtv.dk
4210,Bashkir encyclopedia (Bashkir version) ID,Encyclopedia
4211,Bashkir encyclopedia (Russian version) ID,Bashkir Encyclopedia
4212,PACTOLS thesaurus ID,identifier in the PACTOLS archaeology thesaurus by FRANTIQ
4213,Unicode hex codepoint,hexadecimal codepoint in Unicode
4214,highest observed lifespan,age of the oldest specimen of a taxon for which the age can be verified
4215,nLab ID,name of a page in nLab
4216,LNB Pro A player ID,identifier for a player in the Ligue Nationale de Basket-ball (LNB) Pro A webpages
4217,UK Electoral Commission ID,identifier issued by the Electoral Commission in the UK to identify a political party
4218,shelf life,length of time that a commodity may be stored without becoming unfit for use or consumption
4219,Tyrolean Art Cadastre inventory ID,"identifier of a cadastre published by the regional government of Tyrol, Austria"
4220,order of battle,arrangement of units and hierarchical organization of the armed forces involved in the specified military action
4221,National Criminal Justice ID,"identifier for a publication, report, article or audiovisual product, in the United States' National Criminal Justice Reference Service database"
4222,United Nations Treaty Series Volume Number,volume number within the United Nations Treaty Series
4223,Enciclopedia Italiana ID,identifier for the Enciclopedia Italiana on Treccani website
4224,category contains,category contains elements that are instances of this item
4225,IPA Braille,representation of a IPA phoneme in the Braille system
4226,Cyworld ID,identifier of the subject at Cyworld
4227,Indonesian Small Islands Directory ID,identifier for DPKI directory of small islands by the Indonesian government
4228,Encyclopedia of Australian Science ID,"identifier for a person or organisation in the Encyclopedia of Australian Science, an online compilation of biographical data about Australian scientists and their organisations"
4229,ICD-10-CM,"identifier in the ICD-10-CM (International Classification of Diseases, 10th Revision, Clinical Modification)"
4230,Sefaria ID,"identifier for Sefaria, an online library of Jewish texts with freely licensed content"
4231,United Nations Treaty Series Registration Number,registration number of a treaty within the United Nations Treaty Series
4232,Figshare author ID,identifier for an author on Figshare
4233,PatientLikeMe condition ID,"identifier for a condition on PatientsLikeMe, a website where patients can share health information"
4235,PatientLikeMe treatment ID,"identifier for a treatment on PatientsLikeMe, a website where patients can share health information"
4236,PatientLikeMe symptom ID,"identifier for a symptom on PatientsLikeMe, a website where patients can share health information"
4238,webcam page URL,URL of a page broadcasting pictures by a webcam situated in this location or mounted on this element
4239,vocalized name,item name with full vowel marks
4240,regular expression syntax,qualifier to indicate which syntax/variant of regular expressions applies to a particular pattern
4241,refine date,qualifier to narrow down the precision of a date not fully specified by the Wikidata time datatype precision field
4242,maximal rate of climb,maximum rate of positive altitude change with respect to time for an aircraft
4243,candidate number,number of the candidate in an election
4244,Bavarian monument authority ID,"identifier for cultural heritage monuments (ensembles, buildings and grounds) in Bavaria, issued by the Bavarian State Office for the Preservation of Monuments"
4245,cultural heritage monument in Serbia ID,"identifier for cultural heritage sites in the Republic of Serbia, from the WLM database"
4246,LfD-HB object ID,identifier for cultural heritage monuments issued by the Bremen State Office for the Preservation of Monuments
4247,Tagesschau election ID,identifier of a parliamentary election in the elections archive on tagesschau.de
4248,The Black Book ID,"ID for a person wanted by the Nazi administration, in the case of an invasion of the United Kingdom, as listed in the ""Black Book"" (""Sonderfahndungsliste GB"")"
4249,Vincoli in Rete ID,"identifier of a building or site in the database of the MIBACT (Ministero per i Beni, le Attività Culturali e il Turismo) concerning regulatory constraints on cultural heritage in Italy"
4250,defined daily dose,average maintenance dose per day for a medicine used for its main indication in adults
4251,TSE number,number assigned by the Brazilian Superior Electoral Court to registered political parties
4252,All-Russian Mathematical Portal ID,identifier for a mathematician in the All-Russian Mathematical Portal
4253,number of constituencies,number of constituencies related to a legislative body
4254,Banglapedia (Bengali version) ID,"identifier for a Bengali article on Banglapedia, the national online encyclopedia of Bangladesh"
4255,Banglapedia (English version) ID,"identifier for an English article on Banglapedia, the national online encyclopedia of Bangladesh"
