id, label, description
6,head of government,"head of the executive power of this town, city, municipality, state, country, or other governmental body"
10,video,"relevant video. For images, use the property P18. For trailers, qualify with ""object has role"" (P3831)=""trailer"" (Q622550)"
14,traffic sign,"graphic symbol describing the item, used at the side of or above roads to give instructions or provide information to road users"
15,route map,image of route map at Wikimedia Commons
16,highway system,system (or specific country specific road type) of which the highway is a part
17,country,sovereign state of this item; don't use on humans
18,image,"image of relevant illustration of the subject; if available, use more specific properties (sample: coat of arms image, locator map, flag image, signature image, logo image, collage image); only images which exist on Wikimedia Commons are acceptable"
19,place of birth,"most specific known (e.g. city instead of country, or hospital instead of city) birth location of a person, animal or fictional character"
20,place of death,"most specific known (e.g. city instead of country, or hospital instead of city) death location of a person, animal or fictional character"
21,sex or gender,"sexual identity of subject: male (Q6581097), female (Q6581072), intersex (Q1097630), transgender female (Q1052281), transgender male (Q2449503). Animals: male animal (Q44148), female animal (Q43445). Groups of same gender use ""subclass of"" (P279)"
22,father,"male parent of the subject. For stepfather, use ""stepparent"" (P3448)"
25,mother,"female parent of the subject. For stepmother, use ""stepparent"" (P3448)"
26,spouse,"the subject has the object as their spouse (husband, wife, partner, etc.). Use ""partner"" (P451) for non-married companions"
27,country of citizenship,the object is a country that recognizes the subject as its citizen
30,continent,continent of which the subject is a part
31,instance of,that class of which this subject is a particular example and member (subject typically an individual member with a proper name label); different from P279; using this property as a qualifier is deprecated—use P2868 or P3831 instead
35,head of state,official with the highest formal authority in a country/state
36,capital,"primary city of a country, province, state or other type of administrative territorial entity"
37,official language,language designated as official by this item
38,currency,currency used by item
39,position held,subject currently or formerly holds the object position or public office
40,child,"subject has object as biological, foster, and/or adoptive child"
41,flag image,image of the item's flag
47,shares border with,"countries or administrative subdivisions, of equal level, that this item borders, either by land or water"
50,author,"main creator(s) of a written work (use on works, not humans); use P2093 when Wikidata item is unknown or does not exist"
51,audio,"relevant sound. If available, use a more specific property. Samples: ""spoken text audio"" (P989), ""pronunciation audio"" (P443)"
53,family,"family, including dynasty and nobility houses. Not family name (use P734 for family name)."
54,member of sports team,sports teams or clubs that the subject currently represents or formerly represented
57,director,"director(s) of film, TV-series, stageplay, video game or similar"
58,screenwriter,person(s) who wrote the script for subject item
59,constellation,"the area of the celestial sphere of which the subject is a part (from a scientific standpoint, not an astrological one)"
61,discoverer or inventor,"the entity who discovered, first described,  invented, or developed this discovery or invention"
65,site of astronomical discovery,"the place where an astronomical object was discovered (observatory, satellite)"
66,ancestral home,place of origin for ancestors of subject
69,educated at,educational institution attended by subject
78,top-level Internet domain,Internet domain name system top-level code
81,connecting line,railway or public transport line(s) subject is directly connected to; use as a qualifier to P197
84,architect,person or architectural firm responsible for designing this building
85,anthem,subject's official anthem
86,composer,"person(s) who wrote the music [for lyricist, use ""lyrics by"" (P676)]"
87,librettist,"author of the libretto (words) of an opera, operetta, oratorio or cantata, or of the book of a musical"
88,commissioned by,person or organization that commissioned this work
91,sexual orientation,"the sexual orientation of the person — use IF AND ONLY IF they have stated it themselves, unambiguously, or it has been widely agreed upon by historians after their death"
92,main regulatory text,text setting the main rules by which the subject is regulated
94,coat of arms image,image of the item's coat of arms
97,noble title,titles held by the person
98,editor,editor of a compiled work such as a book or a periodical (newspaper or an academic journal)
101,field of work,specialization of a person or organization; see P106 for the occupation
102,member of political party,the political party of which this politician is or has been a member
103,native language,language or languages a person has learned from early childhood
105,taxon rank,level in a taxonomic hierarchy
106,occupation,"occupation of a person; see also ""field of work"" (Property:P101), ""position held"" (Property:P39)"
108,employer,person or organization for which the subject works or worked
109,signature,image of a person's signature
110,illustrator,person drawing the pictures in a book
111,measured physical quantity,value of a physical property expressed as number multiplied by a unit
112,founded by,"founder or co-founder of this organization, religion or place"
113,airline hub,airport that serves as a hub for an airline
114,airline alliance,alliance the airline belongs to
115,home venue,home stadium or venue of a sports team or applicable performing arts organization
117,chemical structure,image of a representation of the structure for a chemical compound
118,league,league in which team or player plays or has played in
119,place of burial,"location of grave, resting place, place of ash-scattering, etc, (e.g. town/city or cemetery) for a person or animal. There may be several places: e.g. re-burials, cenotaphs, parts of body buried separately."
121,item operated,"equipment, installation or service operated by the subject"
122,basic form of government,subject's government
123,publisher,"organization or person responsible for publishing books, periodicals, games or software"
126,maintained by,person or organization in charge of keeping the subject (for instance an infrastructure) in functioning order
127,owned by,owner of the subject
128,regulates (molecular biology),process regulated by a protein or RNA in molecular biology
129,physically interacts with,physical entity that the subject interacts with
131,located in the administrative territorial entity,the item is located on the territory of the following administrative entity. Use P276 (location) for specifying locations that are non-administrative places and for items about events
134,has dialect (DEPRECATED),"a former property, to be replaced by P4913, that describes a lot of things that are ""dialects"" related"
135,movement,"literary, artistic, scientific or philosophical movement associated with this person or work"
136,genre,creative work's genre or an artist's field of work (P101). Use main subject (P921) to relate creative works to their topic
137,operator,"person, profession, or organization that operates the equipment, facility, or service; use country for diplomatic missions"
138,named after,"entity or event that inspired the subject's name, or namesake (in at least one language)"
140,religion,"religion of a person, organization or religious building, or associated with this subject"
141,IUCN conservation status,conservation status assigned by the International Union for Conservation of Nature
143,imported from Wikimedia project,source of this claim's value; used in references section by bots importing data from Wikimedia projects; also allowed to be used for manual imports
144,based on,the work(s) used as the basis for subject item
149,architectural style,architectural style of a structure
150,contains administrative territorial entity,(list of) direct subdivisions of an administrative territorial entity
154,logo image,"graphic mark or emblem commonly used by commercial enterprises, organizations and products"
155,follows,"immediately prior item in a series of which the subject is a part [if the subject has replaced the preceding item, e.g. political offices, use ""replaces"" (P1365)]"
156,followed by,"immediately following item in a series of which the subject is a part [if the subject has been replaced, e.g. political offices, use ""replaced by"" (P1366)]"
157,killed by,person who killed the subject
158,seal image,image of subject's seal (emblem)
159,headquarters location,"specific location where an organization's headquarters is or has been situated. Inverse property of ""occupant"" (P466)."
161,cast member,"actor in the subject production [use ""character role"" (P453) and/or ""name of the character role"" (P4633) as qualifiers] [use ""voice actor"" (P725) for voice-only role]"
162,producer,"person(s) who produced the film, musical work, theatrical production, etc. (for film, this does not include executive producers, associate producers, etc.) [for production company, use P272, video games - use P178]"
163,flag,subject's flag
166,award received,"award or recognition received by a person, organisation or creative work"
167,structure replaced by,"the item which replaced this building or structure, at the same geographic location"
169,chief executive officer,highest-ranking corporate officer appointed as the CEO within an organization
170,creator,"maker of this creative work or other object (where no more specific property exists). Paintings with unknown painters, use ""anonymous"" (Q4233718) as value."
171,parent taxon,closest parent taxon of the taxon in question
172,ethnic group,"subject's ethnicity (consensus is that a VERY high standard of proof is needed for this field to be used. In general this means 1) the subject claims it him/herself, or 2) it is widely agreed on by scholars, or 3) is fictional and portrayed as such)."
175,performer,"actor, musician, band or other performer associated with this role or musical work"
176,manufacturer,manufacturer or producer of this product
177,crosses,"obstacle (body of water, road, ...) which this bridge crosses over or this tunnel goes under"
178,developer,organisation or person that developed the item
179,part of the series,series which contains the subject
180,depicts,depicted entity (see also P921: main subject)
181,taxon range map image,range map of a taxon
183,endemic to,sole location or habitat type where the taxon lives
184,doctoral advisor,person who supervised the doctorate or PhD thesis of the subject
185,doctoral student,doctoral student(s) of a professor
186,material used,material the subject is made of or derived from
189,location of discovery,where the item was located when discovered
190,twinned administrative body,"twin towns, sister cities, twinned municipalities and other localities that have a partnership or cooperative agreement, either legally or informally acknowledged by their governments"
193,main building contractor,the main organization responsible for construction of this structure or building
194,legislative body,"legislative body governing this entity; political institution with elected representatives, such as a parliament/legislature or council"
195,collection,"art, museum, archival, or bibliographic collection the subject is part of"
196,minor planet group,is in grouping of minor planets according to similar orbital characteristics
197,adjacent station,"the stations next to this station, sharing the same line(s)"
199,business division,organizational divisions of this organization (which are not independent legal entities)
200,inflows,"major inflow sources — rivers, aquifers, glacial runoff, etc. Some terms may not be place names, e.g. none"
201,lake outflow,"rivers and other outflows waterway names. If evaporation or seepage are notable outflows, they may be included. Some terms may not be place names, e.g. evaporation"
205,basin country,country that have drainage to/from or border the body of water
206,located in or next to body of water,"sea, lake or river"
207,bathymetry image,"image showing bathymetric chart, bathymetric map"
208,executive body,branch of government for the daily administration of the state
209,highest judicial authority,"supreme judicial body within a country, administrative division, or other organization"
210,party chief representative,chief representative of a party in an institution or an administrative unit (use qualifier to identify the party)
212,ISBN-13,"identifier for a book (edition), thirteen digit"
213,ISNI,"International Standard Name Identifier for an identity. Format: 4 blocks of 4 digits separated by a space, first block is 0000"
214,VIAF ID,identifier for the Virtual International Authority File database [format: up to 22 digits]
215,spectral class,spectral class of an astronomical object
217,inventory number,identifier for a physical object or a set of physical objects in a collection
218,ISO 639-1 code,two-letter identifier for a language or family of languages defined in ISO 639-1 standard
219,ISO 639-2 code,"identifier for a language or macrolanguage or language family language, defined in ISO 639-2 standard, 3-letter technical or bibliographical  code"
220,ISO 639-3 code,identifier for a language defined in ISO 639-3
221,ISO 639-6 code,identifier for a language per ISO 639-6
223,galaxy morphological type,galaxy morphological classification code
225,taxon name,correct scientific name of a taxon (according to the reference given)
227,GND ID,"identifier from an international authority file of names, subjects, and organizations (please don't use type n = name, disambiguation) - Deutsche Nationalbibliothek"
229,IATA airline designator,two-character identifier for an airline
230,ICAO airline designator,"three letter identifier for an airline (two letters only until 1982) (for airports, see P239)"
231,CAS Registry Number,identifier for a chemical substance or compound per Chemical Abstract Service's Registry database
232,EC number,identifier for a chemical compound per EINECS or ELINCS
233,canonical SMILES,Simplified Molecular Input Line Entry Specification (canonical format)
234,InChI,International Chemical Identifier
235,InChIKey,A hashed version of the full standard InChI - designed to create an identifier that encodes structural information and can also be practically used in web searching.
236,ISSN,International Standard Serial Number (print or electronic)
237,coat of arms,subject's coat of arms
238,IATA airport code,"three-letter identifier for designating airports or cities (for airlines, see P229)"
239,ICAO airport code,"four-character alphanumeric identifier for designating airports (for airlines, see P230)"
240,FAA airport code,three-letter or four-letter alphanumeric code identifying United States airports
241,military branch,"branch to which this military unit, award, office, or person belongs, e.g. Royal Navy"
242,locator map image,geographic map image which highlights the location of the subject within some larger entity
243,OCLC control number,identifier for a unique bibliographic record in OCLC WorldCat
244,Library of Congress authority ID,"Library of Congress identifier for persons, organizations, events, places, titles, and subject headings  [Format: 1-2 specific letters followed by 8-10 digits (see regex). For manifestations of works, use P1144]"
245,ULAN ID,identifier from the Getty Union List of Artist Names
246,element symbol,identifier for a chemical element
247,COSPAR ID,"international satellite designation, administered by the UN Committee on Space Research (COSPAR) and the US National Space Science Data Center (NSSDC)"
248,stated in,to be used in the references field to refer to the information document or database in which a claim is made; for qualifiers use P805
249,ticker symbol,identifier for a publicly traded share of a particular stock on a particular stock market or that of a cryptocurrency
263,official residence,the residence at which heads of government and other senior figures officially reside
264,record label,brand and trademark associated with the marketing of subject music recordings and music videos
267,ATC code,therapeutic chemical identification code per ATC
268,Bibliothèque nationale de France ID,"identifier for the subject issued by BNF (Bibliothèque nationale de France). Format: 8 digits followed by a check-digit or letter, do not include the initial 'cb'."
269,SUDOC authorities ID,"identifier for authority control in the French collaborative library catalog (see also P1025). Format: 8 digits followed by a digit or ""X"""
270,CALIS ID,identifier for authority control per CALIS (China Academic Library & Information System)
271,CiNii author ID (books),identifier for a book author in CiNii (Scholarly and Academic Information Navigator)
272,production company,"company that produced this film, audio or performing arts work"
274,chemical formula,description of chemical compound  giving element symbols and counts
275,license,license under which this copyrighted work is released
276,location,"location of the item, physical object or event is within. In case of an administrative entity use P131. In case of a distinct terrain feature use P706."
277,programming language,the programming language(s) in which the software is developed
278,GOST 7.75–97 code,identifier for a language according to GOST 7.75–97
279,subclass of,all instances of these items are instances of those items; this item is a class (subset) of that item. Not to be confused with P31 (instance of)
281,postal code,identifier assigned by postal authorities for the subject area or building
282,writing system,"alphabet, character set or other system of writing used by a language, supported by a typeface"
286,head coach,"on-field manager or head coach of a sports club (not to be confused with a general manager P505, which is not a coaching position) or person"
287,designed by,person(s) that designed the item
289,vessel class,series of vessels built to the same design of which this vessel is a member
291,place of publication,geographical place of publication of the edition (use 1st edition when referring to works)
296,station code,"generic identifier for a railway station, when possible, use specific property on certain coding system (e.g. P1378 for China Railway TMIS codes)"
297,ISO 3166-1 alpha-2 code,identifier for a country in two-letter format per ISO 3166-1
298,ISO 3166-1 alpha-3 code,identifier for a country in three-letter format per ISO 3166-1
299,ISO 3166-1 numeric code,identifier for a country in numeric format per ISO 3166-1
300,ISO 3166-2 code,identifier for a country subdivision per ISO 3166-2 (include country code)
301,category's main topic,primary topic of the subject Wikimedia category
303,EE breed number,breed identification number per the EE list of the breeds of fancy pigeons (ELFP)
304,page(s),page number of source referenced for statement
305,IETF language tag,identifier for a language per the Internet Engineering Task Force
306,operating system,operating system (OS) on which a software works or the OS installed on hardware
344,director of photography,"person responsible for the framing, lighting, and filtration of the subject work"
345,IMDb ID,"identifier for the IMDb [with prefix 'tt', 'nm', 'co', 'ev', 'ch' or 'ni']"
347,Joconde ID,identifier in the Joconde database of the French Ministry of Culture
348,software version identifier,"numeric or symbolic identifier of version of a software or file format, current and past"
349,National Diet Library Auth ID,identifier for authority control per the National Diet Library of Japan
350,RKDimages ID,identifier per RKDimages of the Netherlands Institute for Art History
351,Entrez Gene ID,identifier for a gene per the NCBI Entrez database
352,UniProt protein ID,identifier for a protein per the UniProt database.
353,HGNC gene symbol,"The official gene symbol approved by the HGNC, which is typically a short form of the gene name."
354,HGNC ID,A unique ID provided by the HGNC for each gene with an approved symbol. HGNC IDs remain stable even if a name or symbol changes.
355,subsidiary,"subsidiary of a company or organization, opposite of parent organization (P749)"
356,DOI,serial code used to uniquely identify digital objects like academic papers (use upper case letters only)
358,discography,link to discography in artist or band page
359,Rijksmonument ID,identifier for a monument assigned by the Rijksdienst voor het Cultureel Erfgoed
360,is a list of,common element between all listed items
361,part of,"object of which the subject is a part (if this subject is already part of object A which is a part of object B, then please only make the subject part of object A). Inverse property of ""has part"" (P527, see also ""has parts of the class"" (P2670))."
364,original language of film or TV show,"language in which a film or a performance work was originally created. Deprecated for written works; use P407 (""language of work or name"") instead."
366,use,main use of the subject (includes current and former usage)
367,astronomic symbol image,image of the symbol that identify a planet or an asteroid of the solar system
368,Sandbox-CommonsMediaFile,"Sandbox property for value of type ""Commons Media File"""
369,Sandbox-Item,"sandbox property for value of type ""Item"""
370,Sandbox-String,"Sandbox property for value of type ""String"""
371,presenter,someone who takes a main role in presenting a radio or television program or a performing arts show
373,Commons category,"name of the Wikimedia Commons category containing files related to this item (without the prefix ""Category:"")"
374,INSEE municipality code,identifier for a municipality per the National Institute of Statistics and Economic Studies in France
375,space launch vehicle,type of rocket or other vehicle for launching subject payload into outer space
376,located on astronomical location,astronomical body on which features or places are situated
377,SCN,"Satellite Catalog Number, 5-digit-number including leading zeros (e.g. '00266')"
380,Mérimée ID,identifier for a monument in the Mérimée database of French cultural heritage
381,PCP reference number,identifier for cultural properties in Switzerland
382,CBS municipality code,identifier for a Dutch municipality as defined by Statistics Netherlands (CBS)
393,edition number,"number of this edition (first, second, ... as 1, 2, ...) of a book or event"
395,licence plate code,distinguishing signs or parts of license plate associated with the subject. For countries: international licence plate country code or distinguishing sign of vehicles
396,SBN author ID,identifier issued by National Library Service (SBN) of Italy
397,parent astronomical body,major astronomical body the item belongs to
398,child astronomical body,minor body that belongs to the item
399,companion of,two or more astronomic bodies of the same type relating to each other
400,platform,"platform for which a work was developed or released, or the specific platform version of a software product"
402,OSM relation ID,identifier for a relation in OpenStreetMap
403,mouth of the watercourse,the body of water to which the watercourse drains
404,game mode,a video game's available playing mode(s)
405,taxon author,the author(s) that (optionally) may be cited with the scientific name
406,soundtrack release,music release that incorporates music directly recorded from the soundtrack of an audiovisual work
407,language of work or name,"language associated with this creative work (such as books, shows, songs, or websites) or a name (for persons use P103 and P1412)"
408,software engine,software engine employed by the subject item
409,Libraries Australia ID,"identifier issued by the National Library of Australia (see also P1315 for the newer People Australia identifier). VIAF component. Format: 1-12 digits, removing leading zero-padding."
410,military rank,"military rank achieved by a person (should usually have a ""start time"" qualifier), or military rank associated with a position"
411,canonization status,stage in the process of attaining sainthood per the subject's religious organization
412,voice type,"person's voice type. expected values: soprano, mezzo-soprano, contralto, countertenor, tenor, baritone, bass (and derivatives)"
413,position played on team / speciality,"position or specialism of a player on a team, e.g. Small Forward"
414,stock exchange,exchange on which this company is traded
415,radio format,describes the overall content broadcast on a radio station
416,quantity symbol,symbol for a mathematical or physical quantity
417,patron saint,patron saint adopted by the subject
418,seal description,description of a subject's seal
421,located in time zone,time zone for this item
423,shooting handedness,whether the hockey player passes or shoots left- or right-handed
424,Wikimedia language code,identifier for a language or variant as used by Wikimedia projects
425,field of this occupation,"activity corresponding to this occupation (use only for occupations - for people use Property:P101, for profession use P425, for companies use P452)"
426,aircraft registration,identifier assigned to an individual aircraft by civil aircraft registry
427,taxonomic type,"the type genus of this family (or subfamily, etc), or the type species of this genus (or subgenus, etc)"
